{
  "$schema": "http://json-schema.org/draft-07/schema#",
  "$id": "https://local-loop-io.github.io/projects/loop-protocol/schemas/v0.1.1/material-dna.schema.json",
  "title": "MaterialDNA",
  "description": "Universal identifier and metadata for any material item or batch in LOOP (v0.1.1 minimal interop)",
  "type": "object",
  "required": [
    "@context",
    "@type",
    "schema_version",
    "id",
    "category",
    "quantity",
    "origin_city",
    "current_city",
    "available_from"
  ],
  "properties": {
    "@context": {
      "description": "JSON-LD context",
      "type": "string",
      "const": "https://local-loop-io.github.io/projects/loop-protocol/contexts/loop-v0.1.1.jsonld"
    },
    "@type": {
      "description": "Object type identifier",
      "type": "string",
      "const": "MaterialDNA"
    },
    "schema_version": {
      "description": "Schema version for the minimal interop flow. Emitters SHOULD use 0.1.1; receivers SHOULD accept additive 0.1.x patch releases.",
      "type": "string",
      "pattern": "^0\\.1\\.[1-9]\\d*$",
      "examples": [
        "0.1.1",
        "0.1.2"
      ]
    },
    "id": {
      "description": "Unique MaterialDNA identifier",
      "type": "string",
      "pattern": "^[A-Z]{2}-[A-Z]{3}-\\d{4}-[A-Z]+-[A-Z0-9]{6,}$",
      "examples": [
        "DE-MUC-2025-PLASTIC-B847F3"
      ]
    },
    "category": {
      "description": "Standardized material category",
      "type": "string",
      "enum": [
        "plastic-pet",
        "plastic-hdpe",
        "plastic-pvc",
        "plastic-ldpe",
        "plastic-pp",
        "plastic-ps",
        "plastic-mixed",
        "metal-steel",
        "metal-aluminum",
        "metal-copper",
        "metal-mixed",
        "organic-food",
        "organic-garden",
        "organic-wood",
        "glass-clear",
        "glass-brown",
        "glass-green",
        "glass-mixed",
        "paper-clean",
        "paper-newsprint",
        "cardboard",
        "paper-mixed",
        "textile-cotton",
        "textile-wool",
        "textile-synthetic",
        "textile-mixed",
        "ewaste-computers",
        "ewaste-phones",
        "ewaste-batteries",
        "ewaste-mixed"
      ]
    },
    "quantity": {
      "description": "Amount of material",
      "type": "object",
      "required": [
        "value",
        "unit"
      ],
      "properties": {
        "value": {
          "description": "Numeric quantity",
          "type": "number",
          "minimum": 0,
          "examples": [
            1000,
            500.5
          ]
        },
        "unit": {
          "description": "Unit of measurement",
          "type": "string",
          "enum": [
            "kg",
            "g",
            "t",
            "l",
            "ml",
            "m3",
            "piece",
            "bundle"
          ],
          "examples": [
            "kg"
          ]
        }
      }
    },
    "quality": {
      "description": "Quality score (0.0 to 1.0)",
      "type": "number",
      "minimum": 0,
      "maximum": 1,
      "examples": [
        0.95
      ]
    },
    "origin_city": {
      "description": "City that registered the material",
      "type": "string",
      "minLength": 2,
      "maxLength": 80,
      "examples": [
        "Munich"
      ]
    },
    "current_city": {
      "description": "City currently holding custody of the material",
      "type": "string",
      "minLength": 2,
      "maxLength": 80,
      "examples": [
        "Munich"
      ]
    },
    "location": {
      "description": "Geographic location of material",
      "type": "object",
      "required": [
        "lat",
        "lon"
      ],
      "properties": {
        "lat": {
          "description": "Latitude",
          "type": "number",
          "minimum": -90,
          "maximum": 90,
          "examples": [
            48.1351
          ]
        },
        "lon": {
          "description": "Longitude",
          "type": "number",
          "minimum": -180,
          "maximum": 180,
          "examples": [
            11.582
          ]
        },
        "address": {
          "description": "Human-readable address",
          "type": "string",
          "examples": [
            "Recycling Center Munich, Sachsenstra\u00dfe 25"
          ]
        }
      }
    },
    "available_from": {
      "description": "When material becomes available (ISO 8601)",
      "type": "string",
      "format": "date-time",
      "examples": [
        "2025-05-27T10:00:00Z"
      ]
    },
    "expires": {
      "description": "When material expires or must be collected (ISO 8601)",
      "type": "string",
      "format": "date-time",
      "examples": [
        "2025-06-03T10:00:00Z"
      ]
    },
    "certifications": {
      "description": "List of certifications",
      "type": "array",
      "items": {
        "type": "string",
        "examples": [
          "food-grade",
          "iso-14001",
          "organic-eu"
        ]
      }
    },
    "images": {
      "description": "Photos of the material",
      "type": "array",
      "items": {
        "type": "string",
        "format": "uri",
        "examples": [
          "https://example.com/material-photo.jpg"
        ]
      },
      "maxItems": 10
    },
    "contact": {
      "description": "Reserved. Personal contact details are not permitted in minimal interop payloads.",
      "not": {}
    },
    "passport": {
      "description": "Optional regulatory interoperability metadata for DPP-style integrations.",
      "type": "object",
      "properties": {
        "passport_id": {
          "type": "string",
          "maxLength": 160
        },
        "passport_url": {
          "type": "string",
          "format": "uri"
        },
        "backup_copy_url": {
          "type": "string",
          "format": "uri"
        },
        "passport_status": {
          "type": "string",
          "enum": [
            "not_applicable",
            "optional",
            "required",
            "available",
            "restricted"
          ]
        },
        "data_carrier_id": {
          "type": "string",
          "maxLength": 160
        },
        "issuer": {
          "type": "string",
          "maxLength": 160
        },
        "access_scope": {
          "type": "string",
          "enum": [
            "public",
            "role-based",
            "restricted"
          ]
        },
        "supported_regimes": {
          "type": "array",
          "items": {
            "type": "string",
            "enum": [
              "espr-dpp",
              "battery-passport",
              "ppwr",
              "waste-shipment",
              "nkws"
            ]
          }
        }
      },
      "additionalProperties": true
    },
    "classification": {
      "description": "Optional classification hints for customs, waste, or product-specific rules.",
      "type": "object",
      "properties": {
        "ewc_code": {
          "type": "string",
          "pattern": "^\\d{2}(\\s\\d{2}){2}$"
        },
        "hs_code": {
          "type": "string",
          "pattern": "^\\d{6,10}$"
        },
        "cn_code": {
          "type": "string",
          "pattern": "^\\d{8}$"
        },
        "battery_category": {
          "type": "string",
          "enum": [
            "portable",
            "lmt",
            "sli",
            "industrial",
            "ev"
          ]
        }
      },
      "additionalProperties": true
    },
    "traceability": {
      "description": "Optional chain-of-custody, retention, and evidence references.",
      "type": "object",
      "properties": {
        "batch_id": {
          "type": "string",
          "maxLength": 120
        },
        "serial_number": {
          "type": "string",
          "maxLength": 160
        },
        "lot_number": {
          "type": "string",
          "maxLength": 120
        },
        "source_operator_id": {
          "type": "string",
          "maxLength": 120
        },
        "facility_id": {
          "type": "string",
          "maxLength": 120
        },
        "retention_until": {
          "type": "string",
          "format": "date-time"
        },
        "document_refs": {
          "type": "array",
          "items": {
            "type": "string",
            "format": "uri"
          },
          "maxItems": 20
        },
        "due_diligence_ref": {
          "type": "string",
          "maxLength": 160
        }
      },
      "additionalProperties": true
    },
    "metadata": {
      "description": "Additional metadata",
      "type": "object",
      "properties": {
        "source": {
          "type": "string",
          "examples": [
            "consumer-collection",
            "industrial",
            "commercial"
          ]
        },
        "batch_number": {
          "type": "string",
          "examples": [
            "2025-W22-01"
          ]
        },
        "notes": {
          "type": "string",
          "maxLength": 500,
          "examples": [
            "Clean, sorted PET bottles"
          ]
        }
      },
      "additionalProperties": true
    }
  },
  "additionalProperties": true
}
